{
  "version": "1.0.0",
  "schemaVersion": "3.0.0",
  "project": "LLMGateway",
  "goalSpecVersion": "1.0.0",
  "status": "draft",

  "designGoals": [
    {
      "id": "DG-001",
      "goal": "Zero configuration friction — a developer must be able to submit a first query within two minutes of installation.",
      "rationale": "Adoption fails if setup is complex. The gateway must feel invisible."
    },
    {
      "id": "DG-002",
      "goal": "Routing decisions must be inspectable without leaving the terminal.",
      "rationale": "Developers distrust black boxes. Visibility builds confidence."
    },
    {
      "id": "DG-003",
      "goal": "All interactions must be operable without a mouse.",
      "rationale": "Target users are developers who live in the terminal and keyboard-driven editors."
    }
  ],

  "personas": [
    {
      "id": "power-developer",
      "name": "Leon",
      "role": "developer",
      "goals": [
        "Submit queries without thinking about which model to use.",
        "Understand why a query was routed to a specific backend.",
        "Override routing quickly when testing a specific model."
      ],
      "painPoints": [
        "Manually switching between tools for different query types.",
        "No visibility into which model handled a request or how long it took.",
        "Configuration scattered across multiple tools."
      ],
      "technicalSkillLevel": "expert",
      "notes": "Primary persona. Comfortable with CLI, config files, and log inspection."
    }
  ],

  "userJourneys": [
    {
      "id": "UJ-001",
      "name": "Submit first query",
      "personaRef": "power-developer",
      "usRefs": ["US-001"],
      "startingState": "Gateway is running. Developer has an OpenAI-compatible client configured to point at the gateway.",
      "steps": [
        { "actor": "user",   "action": "Sends a query via their existing client tool.", "screenRef": "status-view" },
        { "actor": "system", "action": "Classifies the query and routes to the best available backend." },
        { "actor": "system", "action": "Returns response in OpenAI-compatible format." },
        { "actor": "user",   "action": "Receives response in their client tool with no visible difference from direct backend use." }
      ],
      "desiredOutcome": "Developer receives a response without having selected a backend manually."
    },
    {
      "id": "UJ-002",
      "name": "Inspect routing history",
      "personaRef": "power-developer",
      "usRefs": ["US-003"],
      "startingState": "Several queries have been processed. Developer wants to understand routing decisions.",
      "steps": [
        { "actor": "user",   "action": "Runs the log inspection command.", "screenRef": "log-view" },
        { "actor": "system", "action": "Displays a table of recent queries with backend, latency, and status." },
        { "actor": "user",   "action": "Filters the log by backend or time range." },
        { "actor": "system", "action": "Displays the filtered result set." }
      ],
      "desiredOutcome": "Developer can see exactly which backend handled each query and how long it took."
    },
    {
      "id": "UJ-003",
      "name": "Force a specific backend",
      "personaRef": "power-developer",
      "usRefs": ["US-004"],
      "startingState": "Developer wants to test a specific backend directly.",
      "steps": [
        { "actor": "user",   "action": "Passes a backend override flag in their query." },
        { "actor": "system", "action": "Bypasses classification and routes directly to the specified backend." },
        { "actor": "system", "action": "Returns response and logs the override." }
      ],
      "desiredOutcome": "Query is handled by the specified backend without changing global configuration."
    },
    {
      "id": "UJ-004",
      "name": "Configure backends",
      "personaRef": "power-developer",
      "usRefs": ["US-002"],
      "startingState": "Developer wants to add or reprioritise backends.",
      "steps": [
        { "actor": "user",   "action": "Edits the configuration file in their editor.", "screenRef": "config-view" },
        { "actor": "system", "action": "Detects configuration file change and reloads without restart." },
        { "actor": "system", "action": "Confirms reload via a log message." }
      ],
      "desiredOutcome": "New backend configuration is active without restarting the gateway."
    }
  ],

  "informationArchitecture": {
    "root": [
      {
        "name": "Status",
        "screenRef": "status-view"
      },
      {
        "name": "Log",
        "screenRef": "log-view"
      },
      {
        "name": "Config",
        "screenRef": "config-view"
      }
    ],
    "notes": "All views are CLI surfaces, not graphical screens. Navigation is via subcommands, not menus."
  },

  "screenInventory": [
    {
      "id": "status-view",
      "name": "Status View",
      "purpose": "Show the developer the current state of the gateway and all configured backends at a glance.",
      "primaryActions": ["View backend availability", "View current config summary", "View recent query count"],
      "outputs": ["Backend list with status", "Active config path", "Uptime and query count"],
      "usRefs": ["US-001"]
    },
    {
      "id": "log-view",
      "name": "Log View",
      "purpose": "Browse and filter the history of queries processed by the gateway.",
      "primaryActions": ["View query history", "Filter by backend", "Filter by time range"],
      "outputs": ["Query log table with backend, latency, status"],
      "usRefs": ["US-003"]
    },
    {
      "id": "config-view",
      "name": "Config View",
      "purpose": "Inspect the currently loaded backend configuration.",
      "primaryActions": ["View active backends", "View priority order", "View last reload time"],
      "outputs": ["Backend list with priority", "Config file path", "Last reload timestamp"],
      "usRefs": ["US-002"]
    }
  ],

  "screenSpecs": [
    {
      "screenRef": "status-view",
      "layout": "Single-column terminal output. Header line shows gateway version and uptime. Body shows backend table. Footer shows query count and last activity.",
      "wireframe": "LLMGateway v1.0.0 — uptime 2h14m\n\nBACKENDS\n  ● local/qwen3-27b      [available]  priority 1\n  ● cloud/anthropic      [available]  priority 2\n  ○ local/llama-3-8b     [offline]    priority 3\n\nQueries processed: 47  |  Last query: 12s ago",
      "components": [
        {
          "name": "Backend status table",
          "purpose": "Shows each configured backend, its availability, and its priority.",
          "designSystemRef": "StatusTable"
        },
        {
          "name": "Gateway header",
          "purpose": "Shows version and uptime so the developer knows the process is healthy.",
          "designSystemRef": "Header"
        },
        {
          "name": "Activity footer",
          "purpose": "Shows total query count and recency so the developer knows the gateway is receiving traffic.",
          "designSystemRef": "Footer"
        }
      ],
      "states": [
        { "name": "healthy",      "description": "At least one backend is available. All components display normally." },
        { "name": "degraded",     "description": "Some backends are offline. Offline backends shown with ○ indicator and muted text." },
        { "name": "no-backends",  "description": "All backends are offline or unconfigured. Warning message shown. Query processing suspended." }
      ],
      "interactions": [
        {
          "trigger": "Developer runs `gateway status`",
          "response": "Gateway prints the status view to stdout and exits.",
          "patternRef": "command-output"
        },
        {
          "trigger": "Developer runs `gateway status --watch`",
          "response": "Gateway refreshes the status view in-place every 2 seconds until interrupted.",
          "patternRef": "watch-mode"
        }
      ]
    },
    {
      "screenRef": "log-view",
      "layout": "Paginated table output. Each row is one query. Columns: timestamp, backend, latency, status, query preview.",
      "wireframe": "QUERY LOG  (showing 20 of 47)\n\nTIME         BACKEND           LATENCY  STATUS  QUERY\n2m ago       local/qwen3-27b   1.2s     ok      Refactor this function to...\n5m ago       cloud/anthropic   0.8s     ok      What is the capital of...\n12m ago      local/qwen3-27b   2.1s     ok      Write a test for...\n\n[n] next page  [p] prev page  [q] quit",
      "components": [
        {
          "name": "Query log table",
          "purpose": "Shows a paginated list of past queries with routing metadata.",
          "designSystemRef": "DataTable",
          "patternRefs": ["pagination", "keyboard-navigation"]
        },
        {
          "name": "Filter bar",
          "purpose": "Allows the developer to narrow the log by backend or time range.",
          "designSystemRef": "FilterBar"
        }
      ],
      "states": [
        { "name": "populated",  "description": "Queries exist. Table shows most recent first." },
        { "name": "empty",      "description": "No queries have been processed yet. Explanatory message shown." },
        { "name": "filtered",   "description": "A filter is active. Active filter shown above the table." }
      ],
      "interactions": [
        {
          "trigger": "Developer presses n",
          "response": "Log advances to the next page.",
          "patternRef": "pagination"
        },
        {
          "trigger": "Developer runs `gateway log --backend local/qwen3-27b`",
          "response": "Log view pre-filtered to the specified backend.",
          "patternRef": "command-output"
        }
      ]
    },
    {
      "screenRef": "config-view",
      "layout": "Single-column output showing active backends in priority order, config file path, and last reload timestamp.",